{
  "schema_version": "1.0",
  "record_id": "cve/CVE-2026-10000",
  "source_id": "cve",
  "native_id": "CVE-2026-10000",
  "kind": "advisory",
  "status": "active",
  "title": "Synthetic Unicode range preservation",
  "aliases": [
    "CVE-2026-10000"
  ],
  "published_at": "2026-09-08T00:00:00Z",
  "source_modified_at": "2026-09-09T00:00:00Z",
  "first_seen_at": "2026-09-09T01:00:00Z",
  "content_hash": "aaaaaaaaaaaaaaaaaaaaaaaaaaaaaaaaaaaaaaaaaaaaaaaaaaaaaaaaaaaaaaaa",
  "affected": [
    {
      "product": "测试服务",
      "original_ranges": [
        {
          "version": "1.0",
          "lessThan": "2.0",
          "status": "affected",
          "original_expression": "原始范围 αβ >=1.0, <2.0; 原始范围 αβ >=1.0, <2.0; 原始范围 αβ >=1.0, <2.0; 原始范围 αβ >=1.0, <2.0; 原始范围 αβ >=1.0, <2.0; 原始范围 αβ >=1.0, <2.0; 原始范围 αβ >=1.0, <2.0; 原始范围 αβ >=1.0, <2.0; 原始范围 αβ >=1.0, <2.0; 原始范围 αβ >=1.0, <2.0; 原始范围 αβ >=1.0, <2.0; 原始范围 αβ >=1.0, <2.0; 原始范围 αβ >=1.0, <2.0; 原始范围 αβ >=1.0, <2.0; 原始范围 αβ >=1.0, <2.0; 原始范围 αβ >=1.0, <2.0; 原始范围 αβ >=1.0, <2.0; 原始范围 αβ >=1.0, <2.0; 原始范围 αβ >=1.0, <2.0; 原始范围 αβ >=1.0, <2.0; 原始范围 αβ >=1.0, <2.0; 原始范围 αβ >=1.0, <2.0; 原始范围 αβ >=1.0, <2.0; 原始范围 αβ >=1.0, <2.0; 原始范围 αβ >=1.0, <2.0; 原始范围 αβ >=1.0, <2.0; 原始范围 αβ >=1.0, <2.0; 原始范围 αβ >=1.0, <2.0; 原始范围 αβ >=1.0, <2.0; 原始范围 αβ >=1.0, <2.0; 原始范围 αβ >=1.0, <2.0; 原始范围 αβ >=1.0, <2.0; 原始范围 αβ >=1.0, <2.0; 原始范围 αβ >=1.0, <2.0; 原始范围 αβ >=1.0, <2.0; 原始范围 αβ >=1.0, <2.0; 原始范围 αβ >=1.0, <2.0; 原始范围 αβ >=1.0, <2.0; 原始范围 αβ >=1.0, <2.0; 原始范围 αβ >=1.0, <2.0; 原始范围 αβ >=1.0, <2.0; 原始范围 αβ >=1.0, <2.0; 原始范围 αβ >=1.0, <2.0; 原始范围 αβ >=1.0, <2.0; 原始范围 αβ >=1.0, <2.0; 原始范围 αβ >=1.0, <2.0; 原始范围 αβ >=1.0, <2.0; 原始范围 αβ >=1.0, <2.0; 原始范围 αβ >=1.0, <2.0; 原始范围 αβ >=1.0, <2.0; 原始范围 αβ >=1.0, <2.0; 原始范围 αβ >=1.0, <2.0; 原始范围 αβ >=1.0, <2.0; 原始范围 αβ >=1.0, <2.0; 原始范围 αβ >=1.0, <2.0; 原始范围 αβ >=1.0, <2.0; 原始范围 αβ >=1.0, <2.0; 原始范围 αβ >=1.0, <2.0; 原始范围 αβ >=1.0, <2.0; 原始范围 αβ >=1.0, <2.0; 原始范围 αβ >=1.0, <2.0; 原始范围 αβ >=1.0, <2.0; 原始范围 αβ >=1.0, <2.0; 原始范围 αβ >=1.0, <2.0; 原始范围 αβ >=1.0, <2.0; 原始范围 αβ >=1.0, <2.0; 原始范围 αβ >=1.0, <2.0; 原始范围 αβ >=1.0, <2.0; 原始范围 αβ >=1.0, <2.0; 原始范围 αβ >=1.0, <2.0; 原始范围 αβ >=1.0, <2.0; 原始范围 αβ >=1.0, <2.0; 原始范围 αβ >=1.0, <2.0; 原始范围 αβ >=1.0, <2.0; 原始范围 αβ >=1.0, <2.0; 原始范围 αβ >=1.0, <2.0; 原始范围 αβ >=1.0, <2.0; 原始范围 αβ >=1.0, <2.0; 原始范围 αβ >=1.0, <2.0; 原始范围 αβ >=1.0, <2.0; 原始范围 αβ >=1.0, <2.0; 原始范围 αβ >=1.0, <2.0; 原始范围 αβ >=1.0, <2.0; 原始范围 αβ >=1.0, <2.0; 原始范围 αβ >=1.0, <2.0; 原始范围 αβ >=1.0, <2.0; 原始范围 αβ >=1.0, <2.0; 原始范围 αβ >=1.0, <2.0; 原始范围 αβ >=1.0, <2.0; 原始范围 αβ >=1.0, <2.0; 原始范围 αβ >=1.0, <2.0; 原始范围 αβ >=1.0, <2.0; 原始范围 αβ >=1.0, <2.0; 原始范围 αβ >=1.0, <2.0; 原始范围 αβ >=1.0, <2.0; 原始范围 αβ >=1.0, <2.0; 原始范围 αβ >=1.0, <2.0; 原始范围 αβ >=1.0, <2.0; 原始范围 αβ >=1.0, <2.0; 原始范围 αβ >=1.0, <2.0; 原始范围 αβ >=1.0, <2.0; 原始范围 αβ >=1.0, <2.0; 原始范围 αβ >=1.0, <2.0; 原始范围 αβ >=1.0, <2.0; 原始范围 αβ >=1.0, <2.0; 原始范围 αβ >=1.0, <2.0; 原始范围 αβ >=1.0, <2.0; 原始范围 αβ >=1.0, <2.0; 原始范围 αβ >=1.0, <2.0; 原始范围 αβ >=1.0, <2.0; 原始范围 αβ >=1.0, <2.0; 原始范围 αβ >=1.0, <2.0; 原始范围 αβ >=1.0, <2.0; 原始范围 αβ >=1.0, <2.0; 原始范围 αβ >=1.0, <2.0; 原始范围 αβ >=1.0, <2.0; 原始范围 αβ >=1.0, <2.0; 原始范围 αβ >=1.0, <2.0; 原始范围 αβ >=1.0, <2.0; 原始范围 αβ >=1.0, <2.0; 原始范围 αβ >=1.0, <2.0; 原始范围 αβ >=1.0, <2.0; 原始范围 αβ >=1.0, <2.0; 原始范围 αβ >=1.0, <2.0; 原始范围 αβ >=1.0, <2.0; 原始范围 αβ >=1.0, <2.0; 原始范围 αβ >=1.0, <2.0; 原始范围 αβ >=1.0, <2.0; 原始范围 αβ >=1.0, <2.0; 原始范围 αβ >=1.0, <2.0; 原始范围 αβ >=1.0, <2.0; 原始范围 αβ >=1.0, <2.0; 原始范围 αβ >=1.0, <2.0; 原始范围 αβ >=1.0, <2.0; 原始范围 αβ >=1.0, <2.0; 原始范围 αβ >=1.0, <2.0; 原始范围 αβ >=1.0, <2.0; 原始范围 αβ >=1.0, <2.0; 原始范围 αβ >=1.0, <2.0; 原始范围 αβ >=1.0, <2.0; 原始范围 αβ >=1.0, <2.0; 原始范围 αβ >=1.0, <2.0; 原始范围 αβ >=1.0, <2.0; 原始范围 αβ >=1.0, <2.0; 原始范围 αβ >=1.0, <2.0; 原始范围 αβ >=1.0, <2.0; 原始范围 αβ >=1.0, <2.0; 原始范围 αβ >=1.0, <2.0; 原始范围 αβ >=1.0, <2.0; 原始范围 αβ >=1.0, <2.0; 原始范围 αβ >=1.0, <2.0; 原始范围 αβ >=1.0, <2.0; 原始范围 αβ >=1.0, <2.0; 原始范围 αβ >=1.0, <2.0; 原始范围 αβ >=1.0, <2.0; 原始范围 αβ >=1.0, <2.0; 原始范围 αβ >=1.0, <2.0; 原始范围 αβ >=1.0, <2.0; 原始范围 αβ >=1.0, <2.0; 原始范围 αβ >=1.0, <2.0; 原始范围 αβ >=1.0, <2.0; 原始范围 αβ >=1.0, <2.0; 原始范围 αβ >=1.0, <2.0; 原始范围 αβ >=1.0, <2.0; 原始范围 αβ >=1.0, <2.0; 原始范围 αβ >=1.0, <2.0; 原始范围 αβ >=1.0, <2.0; 原始范围 αβ >=1.0, <2.0; 原始范围 αβ >=1.0, <2.0; 原始范围 αβ >=1.0, <2.0; 原始范围 αβ >=1.0, <2.0; 原始范围 αβ >=1.0, <2.0; 原始范围 αβ >=1.0, <2.0; 原始范围 αβ >=1.0, <2.0; 原始范围 αβ >=1.0, <2.0; 原始范围 αβ >=1.0, <2.0; 原始范围 αβ >=1.0, <2.0; 原始范围 αβ >=1.0, <2.0; 原始范围 αβ >=1.0, <2.0; 原始范围 αβ >=1.0, <2.0; 原始范围 αβ >=1.0, <2.0; 原始范围 αβ >=1.0, <2.0; 原始范围 αβ >=1.0, <2.0; 原始范围 αβ >=1.0, <2.0; 原始范围 αβ >=1.0, <2.0; 原始范围 αβ >=1.0, <2.0; 原始范围 αβ >=1.0, <2.0; 原始范围 αβ >=1.0, <2.0; 原始范围 αβ >=1.0, <2.0; 原始范围 αβ >=1.0, <2.0; 原始范围 αβ >=1.0, <2.0; 原始范围 αβ >=1.0, <2.0; 原始范围 αβ >=1.0, <2.0; 原始范围 αβ >=1.0, <2.0; 原始范围 αβ >=1.0, <2.0; 原始范围 αβ >=1.0, <2.0; 原始范围 αβ >=1.0, <2.0; 原始范围 αβ >=1.0, <2.0; 原始范围 αβ >=1.0, <2.0; 原始范围 αβ >=1.0, <2.0; 原始范围 αβ >=1.0, <2.0; 原始范围 αβ >=1.0, <2.0; 原始范围 αβ >=1.0, <2.0; 原始范围 αβ >=1.0, <2.0; 原始范围 αβ >=1.0, <2.0; 原始范围 αβ >=1.0, <2.0; 原始范围 αβ >=1.0, <2.0; 原始范围 αβ >=1.0, <2.0; 原始范围 αβ >=1.0, <2.0; 原始范围 αβ >=1.0, <2.0; 原始范围 αβ >=1.0, <2.0; 原始范围 αβ >=1.0, <2.0; 原始范围 αβ >=1.0, <2.0; 原始范围 αβ >=1.0, <2.0; 原始范围 αβ >=1.0, <2.0; 原始范围 αβ >=1.0, <2.0; 原始范围 αβ >=1.0, <2.0; 原始范围 αβ >=1.0, <2.0; 原始范围 αβ >=1.0, <2.0; 原始范围 αβ >=1.0, <2.0; 原始范围 αβ >=1.0, <2.0; 原始范围 αβ >=1.0, <2.0; 原始范围 αβ >=1.0, <2.0; 原始范围 αβ >=1.0, <2.0; 原始范围 αβ >=1.0, <2.0; 原始范围 αβ >=1.0, <2.0; 原始范围 αβ >=1.0, <2.0; 原始范围 αβ >=1.0, <2.0; 原始范围 αβ >=1.0, <2.0; 原始范围 αβ >=1.0, <2.0; 原始范围 αβ >=1.0, <2.0; 原始范围 αβ >=1.0, <2.0; 原始范围 αβ >=1.0, <2.0; 原始范围 αβ >=1.0, <2.0; 原始范围 αβ >=1.0, <2.0; 原始范围 αβ >=1.0, <2.0; 原始范围 αβ >=1.0, <2.0; 原始范围 αβ >=1.0, <2.0; 原始范围 αβ >=1.0, <2.0; 原始范围 αβ >=1.0, <2.0; 原始范围 αβ >=1.0, <2.0; 原始范围 αβ >=1.0, <2.0; 原始范围 αβ >=1.0, <2.0; 原始范围 αβ >=1.0, <2.0; 原始范围 αβ >=1.0, <2.0; 原始范围 αβ >=1.0, <2.0; 原始范围 αβ >=1.0, <2.0; 原始范围 αβ >=1.0, <2.0; 原始范围 αβ >=1.0, <2.0; 原始范围 αβ >=1.0, <2.0; 原始范围 αβ >=1.0, <2.0; 原始范围 αβ >=1.0, <2.0; 原始范围 αβ >=1.0, <2.0; 原始范围 αβ >=1.0, <2.0; 原始范围 αβ >=1.0, <2.0; 原始范围 αβ >=1.0, <2.0; 原始范围 αβ >=1.0, <2.0; 原始范围 αβ >=1.0, <2.0; 原始范围 αβ >=1.0, <2.0; 原始范围 αβ >=1.0, <2.0; 原始范围 αβ >=1.0, <2.0; 原始范围 αβ >=1.0, <2.0; 原始范围 αβ >=1.0, <2.0; 原始范围 αβ >=1.0, <2.0; 原始范围 αβ >=1.0, <2.0; 原始范围 αβ >=1.0, <2.0; 原始范围 αβ >=1.0, <2.0; 原始范围 αβ >=1.0, <2.0; 原始范围 αβ >=1.0, <2.0; 原始范围 αβ >=1.0, <2.0; 原始范围 αβ >=1.0, <2.0; 原始范围 αβ >=1.0, <2.0; 原始范围 αβ >=1.0, <2.0; 原始范围 αβ >=1.0, <2.0; 原始范围 αβ >=1.0, <2.0; 原始范围 αβ >=1.0, <2.0; 原始范围 αβ >=1.0, <2.0; 原始范围 αβ >=1.0, <2.0; 原始范围 αβ >=1.0, <2.0; 原始范围 αβ >=1.0, <2.0; 原始范围 αβ >=1.0, <2.0; 原始范围 αβ >=1.0, <2.0; 原始范围 αβ >=1.0, <2.0; 原始范围 αβ >=1.0, <2.0; 原始范围 αβ >=1.0, <2.0; 原始范围 αβ >=1.0, <2.0; 原始范围 αβ >=1.0, <2.0; 原始范围 αβ >=1.0, <2.0; 原始范围 αβ >=1.0, <2.0; 原始范围 αβ >=1.0, <2.0; 原始范围 αβ >=1.0, <2.0; 原始范围 αβ >=1.0, <2.0; 原始范围 αβ >=1.0, <2.0; 原始范围 αβ >=1.0, <2.0; 原始范围 αβ >=1.0, <2.0; 原始范围 αβ >=1.0, <2.0; 原始范围 αβ >=1.0, <2.0; 原始范围 αβ >=1.0, <2.0; 原始范围 αβ >=1.0, <2.0; 原始范围 αβ >=1.0, <2.0; 原始范围 αβ >=1.0, <2.0; 原始范围 αβ >=1.0, <2.0; 原始范围 αβ >=1.0, <2.0; 原始范围 αβ >=1.0, <2.0; 原始范围 αβ >=1.0, <2.0; 原始范围 αβ >=1.0, <2.0; 原始范围 αβ >=1.0, <2.0; 原始范围 αβ >=1.0, <2.0; 原始范围 αβ >=1.0, <2.0; 原始范围 αβ >=1.0, <2.0; 原始范围 αβ >=1.0, <2.0; 原始范围 αβ >=1.0, <2.0; 原始范围 αβ >=1.0, <2.0; 原始范围 αβ >=1.0, <2.0; 原始范围 αβ >=1.0, <2.0; 原始范围 αβ >=1.0, <2.0; 原始范围 αβ >=1.0, <2.0; 原始范围 αβ >=1.0, <2.0; 原始范围 αβ >=1.0, <2.0; 原始范围 αβ >=1.0, <2.0; 原始范围 αβ >=1.0, <2.0; 原始范围 αβ >=1.0, <2.0; 原始范围 αβ >=1.0, <2.0; 原始范围 αβ >=1.0, <2.0; 原始范围 αβ >=1.0, <2.0; 原始范围 αβ >=1.0, <2.0; 原始范围 αβ >=1.0, <2.0; 原始范围 αβ >=1.0, <2.0; 原始范围 αβ >=1.0, <2.0; 原始范围 αβ >=1.0, <2.0; 原始范围 αβ >=1.0, <2.0; 原始范围 αβ >=1.0, <2.0; 原始范围 αβ >=1.0, <2.0; 原始范围 αβ >=1.0, <2.0; 原始范围 αβ >=1.0, <2.0; 原始范围 αβ >=1.0, <2.0; 原始范围 αβ >=1.0, <2.0; 原始范围 αβ >=1.0, <2.0; 原始范围 αβ >=1.0, <2.0; 原始范围 αβ >=1.0, <2.0; 原始范围 αβ >=1.0, <2.0; 原始范围 αβ >=1.0, <2.0; 原始范围 αβ >=1.0, <2.0; 原始范围 αβ >=1.0, <2.0; 原始范围 αβ >=1.0, <2.0; 原始范围 αβ >=1.0, <2.0; 原始范围 αβ >=1.0, <2.0; 原始范围 αβ >=1.0, <2.0; 原始范围 αβ >=1.0, <2.0; 原始范围 αβ >=1.0, <2.0; 原始范围 αβ >=1.0, <2.0; 原始范围 αβ >=1.0, <2.0; 原始范围 αβ >=1.0, <2.0; 原始范围 αβ >=1.0, <2.0; 原始范围 αβ >=1.0, <2.0; 原始范围 αβ >=1.0, <2.0; 原始范围 αβ >=1.0, <2.0; 原始范围 αβ >=1.0, <2.0; 原始范围 αβ >=1.0, <2.0; 原始范围 αβ >=1.0, <2.0; 原始范围 αβ >=1.0, <2.0; 原始范围 αβ >=1.0, <2.0; 原始范围 αβ >=1.0, <2.0; 原始范围 αβ >=1.0, <2.0; 原始范围 αβ >=1.0, <2.0; 原始范围 αβ >=1.0, <2.0; 原始范围 αβ >=1.0, <2.0; 原始范围 αβ >=1.0, <2.0; 原始范围 αβ >=1.0, <2.0; 原始范围 αβ >=1.0, <2.0; 原始范围 αβ >=1.0, <2.0; 原始范围 αβ >=1.0, <2.0; 原始范围 αβ >=1.0, <2.0; 原始范围 αβ >=1.0, <2.0; 原始范围 αβ >=1.0, <2.0; 原始范围 αβ >=1.0, <2.0; 原始范围 αβ >=1.0, <2.0; 原始范围 αβ >=1.0, <2.0; 原始范围 αβ >=1.0, <2.0; 原始范围 αβ >=1.0, <2.0; 原始范围 αβ >=1.0, <2.0; 原始范围 αβ >=1.0, <2.0; 原始范围 αβ >=1.0, <2.0; 原始范围 αβ >=1.0, <2.0; 原始范围 αβ >=1.0, <2.0; 原始范围 αβ >=1.0, <2.0; 原始范围 αβ >=1.0, <2.0; 原始范围 αβ >=1.0, <2.0; 原始范围 αβ >=1.0, <2.0; 原始范围 αβ >=1.0, <2.0; 原始范围 αβ >=1.0, <2.0; 原始范围 αβ >=1.0, <2.0; 原始范围 αβ >=1.0, <2.0; 原始范围 αβ >=1.0, <2.0; 原始范围 αβ >=1.0, <2.0; 原始范围 αβ >=1.0, <2.0; 原始范围 αβ >=1.0, <2.0; 原始范围 αβ >=1.0, <2.0; 原始范围 αβ >=1.0, <2.0; 原始范围 αβ >=1.0, <2.0; 原始范围 αβ >=1.0, <2.0; 原始范围 αβ >=1.0, <2.0; 原始范围 αβ >=1.0, <2.0; 原始范围 αβ >=1.0, <2.0; 原始范围 αβ >=1.0, <2.0; 原始范围 αβ >=1.0, <2.0; 原始范围 αβ >=1.0, <2.0; 原始范围 αβ >=1.0, <2.0; 原始范围 αβ >=1.0, <2.0; 原始范围 αβ >=1.0, <2.0; 原始范围 αβ >=1.0, <2.0; 原始范围 αβ >=1.0, <2.0; 原始范围 αβ >=1.0, <2.0; 原始范围 αβ >=1.0, <2.0; 原始范围 αβ >=1.0, <2.0; 原始范围 αβ >=1.0, <2.0; 原始范围 αβ >=1.0, <2.0; 原始范围 αβ >=1.0, <2.0; 原始范围 αβ >=1.0, <2.0; 原始范围 αβ >=1.0, <2.0; 原始范围 αβ >=1.0, <2.0; 原始范围 αβ >=1.0, <2.0; 原始范围 αβ >=1.0, <2.0; 原始范围 αβ >=1.0, <2.0; 原始范围 αβ >=1.0, <2.0; 原始范围 αβ >=1.0, <2.0; 原始范围 αβ >=1.0, <2.0; 原始范围 αβ >=1.0, <2.0; 原始范围 αβ >=1.0, <2.0; 原始范围 αβ >=1.0, <2.0; 原始范围 αβ >=1.0, <2.0; 原始范围 αβ >=1.0, <2.0; 原始范围 αβ >=1.0, <2.0; 原始范围 αβ >=1.0, <2.0; 原始范围 αβ >=1.0, <2.0; 原始范围 αβ >=1.0, <2.0; 原始范围 αβ >=1.0, <2.0; 原始范围 αβ >=1.0, <2.0; 原始范围 αβ >=1.0, <2.0; 原始范围 αβ >=1.0, <2.0; 原始范围 αβ >=1.0, <2.0; 原始范围 αβ >=1.0, <2.0; 原始范围 αβ >=1.0, <2.0; 原始范围 αβ >=1.0,